64,"64","5324231",NA,NA,1,1,1220,2021-10-19 13:00:00,2021-11-30 13:27:00,2021-10-19 15:20:00,2021-10-29 07:36:00,2021-10-18 20:00:00,"42yo male with PMH of alcohol abuse presents as transfer from Holy Family - Haverhill for thrombectomy. Patient last seen normal at 2000 yesterday by his borhter, noted to be very distressed due to recent death of client, and drinking alcohol. This morning around 0800 his brother noticed left facial droop, LUE weakness and altered mental status. EMS was called who noted left sided weakness, left neglect and very combative requiring 400mg Ketamine IM. Once at OSH he continued to require sedation for cooperation. CT/CTA with established infarct in R MCA territory (ASPECTS ~7), R M1 occlusion. Given concerns for airway protection in the setting of multiple sedating medications he was intubated at OSH. Arrived to BMC via medflight air sedated on propofol. BPs stable in the 150's. Examination unable to be obtained given sedation.",1,19.3333333333333,2.33333333333333,17,2,42,1,0,0,155,13.5,28,0,"Physical Exam  Unable to obtain given sedation. Per OSH report -  Awake, alert, confused, not following commands  CN: left facial weakness  Motor: moving right side spontaneously left sided weakness  �  General Assessment:  Stroke Admission Assessment  Does your patient meet criteria for a dysphagia screen?: No  �  Dysphagia Screen:  Patient is intubated (fail)  �  Nutrition:  Diet NPO",NA,NA,NA,NA,"Intubated, after holding sedation, moves right side to a noxious stimulus, does not open eyes, right NPi 3.6 size 2.67, Left NPi 3.8, size 2.21, enact corneal to saline bilaterally, no OCR, intact cough, symmetric face, spontaneously moves right upper extremity and right lower extremity, no movement in left upper extremity, flaccid with finger flexion, triple flexion in left lower extremity",0,NA,1,2021-10-19 13:00:00,4,1,12,0,0,0,0,1,0,NA,NA,"alcohol abuse",1,0,1,2021-10-20 07:01:00,0,0,0,0,"ICU Course  10/19: S/p mechanical thrombectomy of R M1 occlusion with TICI 2c. On propofol, precedex, fentanyl gtt for sedation. SBP goal <150. Nicardipine gtt for blood pressure control. Overnight, experienced episodes of bradycardia to the 20s that proceeded to asystole. ROSC achieved after 1 cycle of CPR and 0.8mg atropine. Precedex discontinued due to bradycardia and PEA arrest. 10/20: R pupil 5mm and unreactive, HCT shows right sided malignant cerebral edema and R uncal herniation -> Sent to OR for emergent decompressive hemicraniotomy. 1 HV and 1 JP drain placed, continue ancef until drains removed. Per NSGY, goal Na <145 -> started 3% balanced solution bolus q6hr and SBP goal <160.?HCT shows improvement in leftward midline shift. CXR showing R middle lobe atelectasis. 10/21: q1hr neuro checks during the day, q2hr at night. Started scheduled tylenol 650mg q6hr. TCDs showing no signs of vasospasm. No BM overnight -> given bisacodyl.?TTE today shows no wall motion abnormalities; EF=60%. Failed pressure support trial due to apnea. 10/22: TCDs continue to appear reassuring, discontinued daily TCDs. Plan to start SQH for DVT ppx this evening. Discontinued foley and femoral central line. PICC placement today. Repeated pressure support trial today. Hemovac removed this morning. 2nd pressure support trail today.?10/23: Femoral line removed. PICC line placed. Plan for extubation, NPO at 4 am. Will be continued Pressure support overnight.?10/24?Extubated to room air, Dobbhoff placed and tube feeds begun. 10/25?Weaned off his sedation, liberalized his neurochecks to every two hours, and advanced his TFs to goal. 10/26?for H. Flu and MSSA?pneumonia, ceftriaxone, then cefepime, then unasyn was ordered until 10/31.10/28: Helmet ordered by NSGY. Continue aggressive pulm care. DHT replaced.?10/29: Helmet arrived: OOB to chair. ?Requiring q30min-1 hr suctioning. 10/30?requiring less frequent suctioning, respiratory status improved. 10/31: HCT stable, ready for transfer.  ?  IMCU Course:  11/1: worsening leukocytosis 11/3: tachycardiac. HCT stable. 11/4: CTPA - segmental/subsegmental acute PEs, no R heart strain. On heparin gtt. HCT stable. 11/6 EEG without seizures. 11/7 improvement in exam, tolerating heparin gtt 11/8: pulled out DHT again 11/11 transferred to floor  ?  Floor Course:  11/12: PEG placed by OR 11/13 dc heparin gtt and started apixaban via gtube 11/14 HCT stable on PO apixaban 11/16 gtube clogged 11/18: passed for puree diet with nectar thick liquids 11/20 not taking in enough calories with PO diet, will proceed with gtube upsize 11/22 gtube upsized with IR 11/23 gtube working well, ready for discharge 11/25 Still waiting on bed and insurance auth 11/30 finally discharging to rehab",NA,2,2021-10-20 06:13:00,2021-10-20 06:13:00,0,2021-10-19 10:34:00,2021-10-20 06:13:00,6.58,2021-10-20 06:13:00,7,1,1,2021-10-20 06:10:00,0,2021-10-20 06:10:00,2021-10-20 06:13:00,2021-10-20 06:13:00,2021-10-20 06:13:00,2021-10-20 06:13:00,1,1,1,1,1,1,NA,34.2166666666667,34.2166666666667,35.0166666666667,34.1666666666667,34.1666666666667,1025.45,NA,34.2166666666667,17.2166666666667,17.2166666666667,18.0166666666667,17.1666666666667,17.1666666666667,1008.45,NA,17.2166666666667,1635492960,2021-10-20 06:10:00,34.1666666666667,17.1666666666667,3,0
66,"66","5325381","2973893",NA,1,1,1227,2021-10-23 06:45:00,2021-11-18 08:00:00,2021-10-23 07:22:00,2021-11-03 08:11:00,2021-10-22 13:00:00,"Ms. Nakiea M Cherry a.k.a Kiea is a 36y.o. female with PMH of heart failure s/p pacer and cocaine misuse, who had a LKW  in the early afternoon when she had a conversation with a man with whom she was staying. Later that evening he found her aphasic, surrounded by drug paraphernalia. She was brought to OSH(GS of SMG) where NIH 18 for expressive aphasia and R hemiplegia. CTH on arrival showed established infarct in the L MCA territory with ASPECTS ~5. She became agitated and required intubation prior to CTA which showed L M1 occlusion. Tox at OSH + for multiple substances including cocaine and fentanyl. Given degree of established infarct, decision made to defer thrombectomy. Directly transferred to SICU for edema watch.",0,18.3666666666667,0.616666666666667,17.75,2,36,0,4,3,70,7.7,18,0,"Physical Exam:  Propofol sedation paused  Does not open eyes  Pupils 3mm bilaterall, PERRL, present corneals  Absent OCRs  Present Cough  BUE witdraw to nox stim  BLE TF to nox stim  Subcutaneous device palpated in left lateral thorax",NA,NA,NA,NA,"Physical Exam:  Propofol sedation paused  Opens eyes to nox stim  Pupils 3mm bilateral, PERRL, present corneals  Does not follow midline/laterall commands  �  LHB spontaneously to nox stim at trap  No movement in RLE",0,NA,0,NA,NA,1,11,0,0,0,0,1,0,NA,NA,"heart failure s/p paper, cocaine misuse",0,0,0,NA,0,0,0,0,"Outstanding Issues at Discharge:   ?  - INR elevated to 4.32 today; plan to hold warfarin until INR falls below 3.5 then restart warfarin at 1.5mg daily til goal INR 2-3  - Continues on Aspirin for cardiac DES  ?  - Broca's aphasia; only speech production is 'why?'  - Does not like to have blood drawn; needs a lot of reassurance  ?  - Follow up on hypercoag panel: ?Anti-beta-2-glycoprotein 1 was positive at a low titer. Lupus anticoagulant was not tested, because she is on warfarin.  ?  ?  Initial HPI: 10/23/2021-Ms. Nakiea M Cherry a.k.a Kiea?is a?36y.o.?female?with PMH of heart failure s/p pacer and cocaine misuse, who?had a?LKW ?in the early afternoon when she had a conversation with a man with whom?she was staying.?Later that evening he found her aphasic, surrounded by drug paraphernalia. She was brought to OSH(GS of SMG)?where NIH 18 for expressive aphasia and R hemiplegia. CTH on arrival showed established infarct in the L MCA territory?with ASPECTS ~5. She became agitated and required intubation prior to CTA which showed L M1 occlusion.?Tox at OSH + for multiple substances including cocaine and fentanyl.?Given degree of established infarct, decision made to defer thrombectomy. Directly transferred to SICU for edema watch.  ?  Brief Summary: 36-year-old woman with a history of polysubstance abuse, HTN, hyperlipidemia, CAD with DES, HFrEF with LVEF 15% who presented on 10/23/21 with aphasia and right hemiplegia. ?CTA showed left M1 occlusion, and CT showed a well-advanced left MCA infarct, to no intervention was pursued. ?  ?  TTE showed RV thrombus and the severely reduced LVEF. ?Toxic screen was positive for cocaine. ?Anti-beta-2-glycoprotein 1 was positive at a low titer and anti-cardiolipins were negative. ?Lupus anticoagulant was not tested, because she is on warfarin. She has Broca's aphasia. ?Her only speech production is 'why?' ?She has problems with comprehension, but she comprehends many things. ?She cannot name or repeat. ?Dense right hemiplegia persists. ?She continues on warfarin for secondary stroke prevention in the setting of severe cardiomyopathy and RV thrombus. ?  ?  Speech Language Pathology (SLP) followed patient throughout hospitalization and patient is currently tolerating a puree diet; please see last assessment below.  PT/OT assessed paitient and recommended acute rehab.  Patient was educated on stroke identification using the FAST scale, rehabilitation after stroke, emotional changes after stroke, new medications, and personal modifiable risk factors to help prevent stroke.  Etiology of stroke thought to likely to be cardioembolic. ?NIHSS at discharge was 18.  ?",NA,2,NA,NA,2.45,2021-10-25 10:43:00,NA,2.05,2021-10-25 10:43:00,4,0,0,NA,0,NA,2021-10-22 23:39:00,NA,NA,NA,0,0,0,0,0,0,NA,NA,NA,NA,NA,NA,643,NA,10.65,NA,NA,NA,NA,NA,625.25,NA,-7.1,1635927060,2021-11-03 08:12:00,283.2,265.45,6,1
67,"67","2773306",NA,NA,1,1,NA,2021-10-26 13:28:00,2021-11-13 16:14:00,2021-10-26 19:17:00,2021-11-01 13:18:00,2021-10-26 13:00:00,"30yo female with no PMH presents with concerns of seizure. Per EMS report and patient she was last known normal at 1300 today at work, she then had sudden onset headache with blurry vision in her left eye. Then she blacked out, per report was on her right side, there was shaking of the left upper extremity, gaze midline, eye open, then speech was slurred, nonsensical with tongue bite, no incontinence. Brought to BMC where code stroke was called for inability to speak and right facial weakness; initial BP: 146/95. Patient already in CT scanner so examination not obtained by stroke initially. After completion of CTA patient vomited several times in CT scanner. NIHSS 4; Exam with mild wording finding difficulty, right facial weakness and decreased sensation in right face, BP: 180/104. CTA with left M2 occlusion. Decision made to give tpa given the disabling symptom of aphasia.   tpa bolus given 1444, BP 180/104, nicardipine started at 2.5mg/hr. Examination very blood pressure dependent. After extensive discussion with patient, patient's sister, and Neuro IR team it was decided to persue mechanical thrombectomy. Delay to IR due to consenting.",1,6.28333333333333,5.81666666666667,0.466666666666667,2,30,0,1,0,116,5.3,4,0,"1405 BP: 162/98 NIHSS 4  Gen: tearful  MS: awake�and�alert, not oriented to month, knows age. Speech is nonfluent with word finding difficulty and paraphasic errors. Able to name common objects, repetition intact, can follow one step commands, not 2 step commands.   CN: PERRL, VFFTC, EOMI without nystagmus, sensation to LT decreased in right face, right facial weakness, tongue protrudes midline  MOTOR: antigravity in all 4 extremities without drift  SENSATION: intact and symmetric to LT in BUE and BLE  CEREBELLUM: FTN intact�without�dysmetria  �  1519 BP: 199/113 NIHSS 3  Gen: well appearing  MS: awake�and�alert, oriented to month, knows age. Speech is nonfluent with word finding difficulty and paraphasic errors. Able to name common objects, repetition intact, can follow one step commands, not 2 step commands.   CN: PERRL, VFFTC, EOMI without nystagmus, sensation to LT decreased in right face, right facial weakness, tongue protrudes midline  MOTOR: antigravity in all 4 extrmities without drift  SENSATION: intact and symmetric to LT in BUE and BLE  CEREBELLUM: FTN intact�without�dysmetria  �  1545 BP 153/94 NIHSS 7  Gen: tearful   MS: awake�and�alert, not oriented to month, knows age. Speech is nonfluent with significant word finding difficulty and paraphasic errors. Unable to name objects, cannot repeat, can follow commands.   CN: PERRL, VFFTC, EOMI without nystagmus, sensation to LT decreased in right face, right facial weakness, tongue protrudes midline  MOTOR: RUE drift  SENSATION: decreased to LT in RUE  CEREBELLUM: FTN intact�without�dysmetria  �",NA,NA,NA,NA,"Attempted to visit patient for therapy, but was unable for the following reasons:patient not medically appropriate for therapy intervention  �  Additional Comments: Pt on Bedrest until 1500pm per team.  PT to follow up for evaluation as appropriate.",1,2021-10-26 14:44:00,1,2021-10-26 17:50:00,2,0,6,0,0,0,0,0,1,NA,NA,NA,0,0,0,NA,0,0,0,0,"Ms. Wright is a 30 yr F with no PMH presented on 10/26 with concerns of seizure. LKW 1300 10/26.  Reported headache, blurry vision in left eye, and shaking of LUE, slurred speech,  nonsensical with tongue bite. NIHSS 4; Exam with mild wording finding difficulty, right facial weakness and decreased sensation in right face, BP: 180/104. CTA with left M2 occlusion, ASPECTS 10. tPA given and  Mechanical thrombectomy persued: M2 occlusion without recanalization despite >5 passes and MCA was TICI 2A. Self extubated on 10/27.  Malignant cerebral edema developed on 10/28 requiring HTS. TTE showing PFO, raising concern for cardioembolism. TEE negative with hypercoag panel pending as below. MRI Brain w/wo completed showing area of restricted diffusion of L superior frontal temporal region, without hemorrhage or new areas of infarct. Patient had an uneventful course on the stroke floor and was d/c to rehab.",NA,2,NA,NA,3.92,2021-10-29 06:05:00,NA,2.34,2021-10-29 06:05:00,10,0,0,NA,0,NA,2021-10-28 13:07:00,NA,NA,NA,0,0,0,0,0,0,NA,NA,NA,NA,NA,NA,435.233333333333,NA,48.1166666666667,NA,NA,NA,NA,NA,434.766666666667,NA,47.65,1635772680,2021-11-01 13:19:00,144.316666666667,143.85,3,1
69,"69","5327096",NA,NA,1,1,1238,2021-10-30 23:53:00,2021-11-05 17:43:00,2021-10-31 04:33:00,2021-11-04 07:02:00,2021-10-30 19:00:00,"Mr. Woods is a 68yoM with PMHx of HTN and HLD, transferred from OSH with R ICA occlusion.  �  Last known well at 7pm this evening (10/30), was normal and then went to bathroom and wife heard a thud, found pt on the ground with L sided weakness. He was initially brought to Catholic Medical Center, NIHSS 15, CT/CTA with R carotid terminus occlusion, ASPECTS 5-7, patient was given tPA and then transferred to BMC for emergent thrombectomy.  �  On arrival to BMC, NIHSS of 15 for L sided plegia, L HH, L sided neglect, otherwise pt awake and alert. Went directly to IR suite, TICI 3 of R ICA occlusion after 3 passes.",1,9.55,4.66666666666667,4.88333333333333,2,68,1,4,3,168,10.9,15,0,"General: Large hematoma over left shoulder and upper torso  Mental Status: Opens eyes to voice frequently falling back asleep, oriented to self, BMC, month, year. Speech dysarthric, naming intact  Cranial Nerve: PERRL, R gaze preference, reduced BTT on left, lower L facial droop  Motor: Antigravity in RUE and RUE, no movement in LUE, slight attempt at movement of LLE  Sensory: Unaware of being touched in LUE or LLE  Coordination: FTN in R hand without dysmetria",NA,NA,NA,NA,"Lying in bed, NAD  Intubated, sedated on fent/prop  No EO, PERRL, NPIs >4.5 bilat  Has corneals and cough  RUE withdraws to noxious  LUE extends to noxious  BLE wiggles toes to command  �  Flap soft  Cranial incision dressing in place  �  hemovac sanguineous output",0,NA,1,2021-10-31 02:35:00,5,1,5,0,1,0,0,1,0,0,NA,"HLD",1,1,1,2021-10-31 16:41:00,0,0,0,0,"On arrival to BMC, NIHSS of 15 for L sided plegia, L HH, L sided neglect, otherwise pt awake and alert. Went directly to IR suite, TICI 3 of R ICA occlusion after 3 passes. Course c/b malignant MCA syndrome with worsening exam requiring intubation and emergent decompressive hemicrani with hypertonics and reversal of tpa with cyroprecipitate. Ultimately, after family meeting it was decided that the patient would not want to live with these deficits (see ACP note from 11/4), extubated on 11/4 and transitioned to CMO on morphine gtt, plan to transition to hospice care. Patient pronounced death at 17:43 on 11/05/2021. Patient passed away comfortably.",NA,2,2021-10-31 09:18:00,2021-10-31 09:18:00,9.91,2021-10-31 09:18:00,2021-10-31 14:23:00,6.54,2021-11-01 02:47:00,5,1,1,2021-10-31 12:00:00,1,2021-10-31 12:00:00,2021-10-31 09:18:00,2021-10-31 09:18:00,2021-10-31 09:18:00,2021-10-31 14:23:00,1,1,1,1,1,1,NA,14.3,19.3833333333333,21.6833333333333,17,17,142.716666666667,NA,14.3,9.41666666666667,14.5,16.8,12.1166666666667,12.1166666666667,137.833333333333,NA,9.41666666666667,1636009320,2021-10-31 12:00:00,17,12.1166666666667,6,0
70,"70","2859548",NA,NA,1,1,NA,2021-11-02 10:08:00,2021-11-23 23:16:00,2021-11-02 10:09:00,2021-11-10 07:57:00,2021-11-01 22:00:00,"Chief Complaint: Stroke  HPI:   Mr. Perry is a 59yoM with PMHx of HTN and epilepsy, presenting to BMC as a direct transfer for large L MCA stroke.     Per report, last known well is unknown, he was found by his girlfriend this morning concerned that he was having a seizure, not speaking. He was brought to carney hospital the morning of 11/2 where there was concern he was either post-ictal or altered, initial non-contrast CT head without any abnormalities noted on their read. The patient remained altered while in the ED, repeat CT head with hypodensity throughout the L MCA as well as dense MCA sign on the left. His workup there was also notable for Utox positive for cocaine, cannabis, as well as alcohol. He received 1g IV keppra and 1L of IVF, Carney then called BMC and on review of the images, given his poor ASPECTS of 5 and unknown LKW he was deemed not a candidate for tpa or mechanical thrombectomy, transferred for crani watch.     Initial NIHSS on arrival to BMC of 21.",0,12.15,0.0166666666666667,12.1333333333333,2,59,1,1,0,70,9.2,21,0,"Physical Exam  Mental Status: Eyes open, awake, tracks examiner. Very garbled speech, unable to say any intelligible words, no fluency, unable to name objects. Follows commands to open and close eyes but no appendicular commands.  Cranial Nerve: PERRL, L gaze preference unable to cross midline, BTT intact bilaterally, R facial droop.  Motor/Sensory: Antigravity in LUE and LLE, withdraws to pain in RLE, no withdrawal in RUE  �  PULM : Non labored. CTA anteriorly.   CVS : S1/ S2, RRR   ABD : Soft/ NT",NA,NA,NA,NA,"Mental Status: Eyes open, awake, tracks examiner. Very garbled speech, unable to say any intelligible words, no fluency, unable to name objects. Follows commands to open and close eyes but no appendicular commands able to respond yes/no with dysarthria  Cranial Nerve: PERRL, L gaze preference unable to cross midline, BTT intact bilaterally, R facial droop.  Motor/Sensory: Antigravity in LUE and LLE, withdraws to pain in RLE, no withdrawal in RUE",0,NA,0,NA,NA,0,8,0,1,0,0,1,0,NA,NA,"epilepsy",1,0,0,NA,0,0,0,0,"Mr. Perry is a 59yoM with PMHx of HTN and epilepsy, presenting to BMC as a direct transfer for large L MCA stroke 2/2 L ICA terminus occlusion. Patient presented outside of tPA window, and was not a MT candidate b/c ASPECTS of 5. He was admitted to NCC for hemicrani watch and received hyperosmolar therapy while in the ICU, with increase in Na up to 160. He did not require surgical intervention. He was then transferred to the stroke service for further management. His hospital course was c/b Klebsiella pneumonia, which was treated with levofloxacin for 7 days (last date on 11/17). He had pain on the right side of his body that was thought related to his stroke so started on Gabapentin 300mg TID. A right lower extremity DVT in the common femoral vein. A PICC associated DVT was also found in his left upper arm. He was started on Heparin and then transitioned to Apixiban on 11/18/21  ?  His stroke etiology was thought most likely cardioembolic in conjunction with active cocaine use. His other work-up was negative including a hypercoag work-up. His factor VB leiden and prothrombin were pending on discharge. TTE was negative without PFO, thrombus and EF of 65%. Plan for him to get Holter monitor on discharge. Pt recommended for acute rehab and discharged without problems. His long hospital stay was related mostly to him requiring gaurdianship",NA,2,2021-11-05 03:40:00,NA,5.09,2021-11-05 03:40:00,NA,2.9,2021-11-04 01:20:00,5,0,0,NA,0,NA,2021-11-01 22:31:00,2021-11-05 03:40:00,NA,NA,0,0,1,0,0,0,NA,77.6666666666667,NA,NA,NA,NA,529.266666666667,NA,0.516666666666667,65.5333333333333,NA,NA,NA,NA,517.133333333333,NA,-11.6166666666667,1636531020,2021-11-10 07:58:00,201.966666666667,189.833333333333,10,1
76,"76","5336797","3220283",NA,1,1,1383,2021-11-29 14:07:00,2021-12-13 18:41:00,2021-11-29 17:04:00,2021-12-02 16:04:00,2021-11-29 10:30:00,"93yo female with PMH of HTN, CKD, DM2, provoked seizure in the setting of hyperglycemia, prior right parietal stroke, gout, and hyperaldosteronism presents after a fall with left sided weakness.   Per report daughter head a 'thud' at 10:30am, and then found her mother on the floor with head against a bookcase. Unclear what occurred between the time when she was found down and then EMS was called.  EMS placed C-collar on patient and noted left sided weakness and right eye deviation. On arrival BP: 182/96 NIHSS: 21 Exam with a right gaze, no BTT from left, left facial, followed midline commands, mild dysarthria noted. No movement on the left side with neglect. CT with hypo density in the right insulation and chronic infarcts, ASPECTS 7. CTA with right distal M1 occlusion. tap was discussed but given later window presentation, fall, age, and hx of prior stroke it was decided not to give. Patient was brought to IR from mechanical thrombectomy. En route to IR her BP was elevated to 215 and was able to left LUE antigravity briefly.    Patient was originally engaged with neurology in 7/2015 for episode of starring were described as each lasting few mins, followed by confusion, characterized by turning her head to the right and having a R upward gaze. Patient's symptoms have resolved in the hospital with correction of sodium, glucose, serum ism and loading with fosphenytoin. Routine EEG revealed L>R slowing in temporal lobes, otherwise unremarkable for epileptiform discharges. She was transitions from phenytoin to keppra in the outpatient setting and remained seizure free on Keppra 250mg BID for several years. She was titrated off Keppra 250mg BID in 4/2019 with no further reports of episodes.",1,6.56666666666667,2.95,3.61666666666667,2,93,0,1,0,189,8.4,21,0,"Physical Exam    Eyes open, alert, able to say name, could state age, and month. Speech was dysarthric and she was able to follow simple commands. Could not nbame or repeat  CN: PERRL, R gaze, (no OCRS given cspine), no BTT form left. Left facial weakness   Motor: moves RUE spontaneously. LUE and LLE without movement, grimace to pain and withdrawling RLE to pain   SEN: neglecting left side",NA,NA,NA,NA,"General:�Chronically ill appearing female lying in bed, c-collar in place.   HEENT: Nasal trumpet in left nare  Mental Status:�Apraxia, knows name, place  CN:�Right gaze preference, left facial droop. �Does not protrude tongue. Dysarthria   Motor:�RUE antigravity , RLE withdraws to painful stimuli, LUE, LLE minimal movement with painful stimuli  Sensation:�Grimaces to painful stimuli  Pulm:�NC in place 2L, Expiratory wheezes in anterior fields  CV:�Tachycardic, Sinus,   Abdomen:�Soft, ND/NT  �",0,NA,1,2021-11-29 15:00:00,0,0,6,0,1,1,1,1,0,NA,NA,"CKD, provoked seizure in the setting of hyperglycemia, prior right parietal stroke, gout, and hyperaldosteronism",0,1,0,NA,0,0,0,0,"93yo female with PMH of HTN, CKD, DM2, provoked seizure in the setting of hyperglycemia, prior right parietal stroke, gout, and hyperaldosteronism who presented on 11/29 after a fall with left sided weakness. CT with hypodensity in the right insula and chronic infarcts, ASPECTS 7. CTA with right distal M1 occlusion. tpa was dicussed but given later window presentation, fall, age, and hx of prior stroke it was decided not to give. Patient was brought to IR for mechanical thrombectomy, TICI 0. On initial presentation to the ICU pt initially hyperglycemic and requiring insuline gtt and started on antihypertensive to meet goal blood pressure. Endocrine was consulted and pt transitioned off insulin gtt and started on standing Insulin. See below Endocrine note for recs. MRI brain was done that showed large R MCA infarct with small areas of petechial hemorrhagic transformation. Given pt presented after fall MRI C spine was done and pt's C-collar was cleared.  TTE was done that showed EF 70% and no thrombus. Etiology of her stroke was thought most likely cardioembolic. LDL was 75 and pt started on atorva 20, ASA 81. Plan for Holter monitor on discharge. After discussion with family made DNR/DNI however was within GOC to pursue PEG. PEG was placed on 12/9.",NA,2,NA,NA,2.6,2021-12-01 02:44:00,NA,3.01,2021-12-01 02:44:00,7,0,0,NA,0,NA,2021-11-29 20:26:00,NA,NA,NA,0,0,0,0,0,0,NA,NA,NA,NA,NA,NA,344.183333333333,NA,9.93333333333333,NA,NA,NA,NA,NA,340.566666666667,NA,6.31666666666667,1638461040,2021-12-02 16:05:00,77.5833333333333,73.9666666666667,11,0
