"id","masterid","mrn","alt_mrn","cdwid","elig","sgobtained","sgid","presdt","dischdt","firstpupildt","lastpupildt","lsw","lswparagraph","lswe","lswfirstpupil","prespupil","lswpres","screening_complete","age","sex","race","ethn","gluc1","wbc1","nihsspres","medcalpres","exampres","nihss24","nihss24dt","hours_after_complex","nihss24sed","exam24","tpa","tpadt","mt","mtdt","tici","vent","los","pmh___0","pmh___1","pmh___2","pmh___3","pmh___4","pmh___5","substance_use","substance_type","otherrf","mls5","gca","surg","surgdt","death","cause_death___1","cause_death___2","cause_death___3","hospcourse","clincom","clinical_and_outcome_data_complete","mls5dt","mls7dt","maxmls","maxmlsdt","pgs4dt","maxpgs","maxpgsdt","aspects1","nd","ndce","nddt","cmo","ndcedt","eligdt","ltmedt","ltme2dt","ltme3dt","mls7","pgs4","ltme","ltme2","ltme3","plme","dthdt","lsw_to_mls5","lsw_to_pgs4","lsw_to_surg","lsw_to_nd","lsw_to_ndce","lsw_to_disch","lsw_to_dth","lsw_to_eligdt","presdt_to_mls5","presdt_to_pgs4","presdt_to_surg","presdt_to_nd","presdt_to_ndce","presdt_to_disch","presdt_to_dth","presdt_to_eligdt","gap_censordt","censordt","fo_time","obs_time","mingcs","ifosmotic"
3,"3","5122858",NA,132,1,1,271,2019-12-19 00:35:00,2019-12-24 23:11:00,2019-12-19 09:25:00,2019-12-24 15:57:00,2019-12-18 21:00:00,"84 year old female with PMH of HTN, COPD, HLD, tobacco use, peripheral neuropathy, hyperthyroidism who is presenting from OSH for thrombectomy. As per son, Patient was LKW 12/18/19 at 9 pm when they had gone to dinner. At 9:15 when getting out of the car, the patient started to slur her speech and then was weak on her right side and almost tripped scraping her right knee but her son caught her and bought her to norwood hospital. There NIHSS scale was 10. CTA with L MCA M2 Occlusion. She received tPA at 10:33 PM and was sent to BMC for thrombectomy in light of LVO.      Upon arrival to BMC ED, NIHSS was a 10(2 for confusion, 2 for dysarthria, 2 for aphasia, 2 of R arm drift, 2 for R leg drift). She was taken to thrombectomy but due to severe atherosclerosis neuroIR team was unable to cross aorta. Right femoral and Right radial access were tried and procedure was aborted. She was taken to the ICU where due to worsening respiratory status she was intubated.      PMH   As per HPI     Allergies  NKDA      SH  Smoker",0,12.4166666666667,8.83333333333333,3.58333333333333,2,84,0,0,0,238,9.4,10,0,"General: Laying in stretcher with oxygen mask in place  Mental Status: Unable to tell what month or year it is. Incoherently answering questions  Cranial Nerve: EOMI horizontally, no facial droop, BTT intact  Motor: drift in right arm and right lef. Able to raise left arm and leg AG for 10 seconds without drift  Coordination: unable to obtain  Gait: Unable to test",19,2019-12-20 01:00:00,28,1,"Physical Exam:    ?  Glasgow Coma Scale  Eye Opening: (2) To pain (from sternum/limb/supra-orbital pressure)  Motor Response: (5) Localizes pain (arm attempts to remove supra-orbital/chest pressure)  Verbal Response: (1) sedated  Total GCS Score (3-15): 8  ?  General: Laying in bed sedated, intubated.  ?  CN:  PERRL 3->2 bilaterally. no gaze preference. Face sensation symmetric,  no facial droop.   ?  Motor:  Moves spontaneously 4 extrimeties L>R.  ?  Sensation:   Reflexes: 2+ reflexes L, 3+ R",1,2019-12-19 22:33:00,0,NA,NA,1,5,0,1,0,0,1,0,1,"tobacco","COPD, HLD, hyperthyroidism",0,1,0,NA,1,0,1,0,"84 year old female with PMH of HTN,?COPD,?HLD, tobacco use, peripheral neuropathy, hyperthyroidism?who is presenting from OSH for thrombectomy. As per son, Patient was LKW 12/18/19 at 9 pm when they had gone to dinner. At 9:15 when getting out of the car, the patient started to slur her speech and then was weak on her right side and almost tripped scraping her right knee but her son caught her and bought her to norwood hospital. There NIHSS scale was 10. CTA with L MCA M2 Occlusion. She received tPA?at 10:33 PM?and was sent to BMC for thrombectomy in light of LVO.  ? Upon arrival to BMC ED, NIHSS was a 10 (2 for confusion, 2 for dysarthria, 2 for aphasia, 2 of R arm drift, 2 for R leg drift). She was taken to thrombectomy but due to severe atherosclerosis neuroIR team was unable to cross aorta. Right femoral and Right radial access were tried and procedure was aborted. She was taken to the ICU where due to worsening respiratory status she was intubated. ? During her hospitalization, she developed afib with RVR and became febrile with aspiration pneumonia as the likely source of infection. She was unable to wean off the ventilator. Upon further discussion with family, she was made CMO and died shortly thereafter.",NA,2,NA,NA,0,2019-12-19 05:36:00,NA,NA,NA,6,0,0,NA,1,NA,2019-12-19 14:17:00,NA,NA,NA,0,0,0,0,0,0,2019-12-24 23:11:00,NA,NA,NA,NA,NA,146.183333333333,146.183333333333,17.2833333333333,NA,NA,NA,NA,NA,142.6,142.6,13.7,1577203020,2019-12-23 15:57:00,114.95,111.366666666667,3,0
4,"4","5122178",NA,131,1,1,270,2019-12-15 09:36:00,2019-12-22 10:30:00,2019-12-15 14:11:00,2019-12-16 08:10:00,2019-12-14 23:30:00,"Patient was last known well at midnight the night prior to presentation when she went to bed. She then was found on the floor this AM at 7am with left sided weakness.",0,14.6833333333333,4.58333333333333,10.1,2,59,0,0,1,160,8.4,17,0,"NIH Stroke Scale  NIH Stroke Scale Date: 12/15/19  NIH Stroke Scale Time: 0920  Level of consciousness:: 0: Alert, keenly responsive  LOC Questions:: 2: Performs neither task correctly  LOC Commands:: 2: Performs neither task correctly  Best Gaze:: 0: Normal  Vision:: 2: Complete hemianopia  Facial Palsy:: 2: Partial paralysis (lower face only)  Motor Right Arm:: 0: No drift, limb holds 90 (or 45) degrees for full 10 seconds  Motor Left Arm:: 3: No effort against gravity, limb falls  Motor Right Leg:: 0: No drift, limb holds 90 (or 45) degrees for full 10 seconds  Motor Left Leg:: 3: No effort against gravity, limb falls  Limb Ataxia:: 0: Absent  Sensory:: 1: Mild to moderate sensory loss, patient feels pinprick is less sharp or is dull on the affected side, there is a loss of superficial pain with pinprick but patient is aware he/she is being touched  Best Language:: 0: No aphasia, normal  Dysarthria:: 1: Mild to moderate, patient slurs at least some words and at worst, can be understood with some difficulty  Extinction and Inattention:: 1: Inattention/extinction to bilateral stimulation in one sensory modality  NIH Total Score:: 17  ?",32,2019-12-16 09:00:00,33.5,1,"General: Lying in bed, intubated, on phenylephrine  Mental Status: Not opening eyes to voice or pain or following any commands  CN: Pupils 5.4 mm and nonreactive b/l, corneals absent to gauze  Motor: Not withdrawing to pain    Glasgow Coma Scale  Eye Opening: (1) None (even to supra-orbital pressure)  Motor Response: (1) None (to any pain, limbs remain flaccid)  Verbal Response: (1) Intubated  Total GCS Score (3-15): 3t",0,NA,1,2019-12-15 10:38:00,5,1,7,0,1,1,0,0,0,NA,NA,NA,1,0,1,2019-12-16 08:37:00,1,1,0,0,"Hospital Course: 59 yo woman with HTN & DM admitted from OSH after being found by family at 0700 12/15 on the floor with L sided weakness and confused. Found to have a R MCA occlusion now s/p thrombectomy via aspiration, TICI 3 (was outside the TPA window as LKW was before bed around midnight). Transferred to SICU for q1h neuro checks, continues to have LUE paralysis and LLE only flexing to pain. Lethargic overnight, then started having sluggish left pupil, given 3% HTS. Left pupil nonreactive, followed by fixed and dilated pupils b/l. 12/16 STAT CT head done due to fixed pupils showed interval worsening of edema from large R MCA infarct with worsened MLS up to 8 mm associated with uncal herniation, effacement of the basilar cisterns and worsening cerebellar tonsillar herniation. Given mannitol and 23% IV. Patient with labile blood pressure overnight, on levo, neo initially started and then DC'd. Straight cath'ed at midnight for 1L and 6am for 1.4L, likely DI. Na 162->178, SOsm 376. WBC 14.7, pancultured for high lactate (3.4), given 1L bolus NS, lactate 2.1-> UA negative. SC 1+ Staph aureus. BC negative. Family meeting held. Decision made to start brain death exam when Na normalizes. 12/17 Blood pressure overnight still labile, on levo. Na 180->175, SOsm 365. Troponin initially high downtrended 12/18 Na 163 -> 160. 200-300ml of coffee ground blood in NG tube, likely upper GIB s/p PPI and GI c/s - no scope, day team with no new recommendations. S/p 2L IVF for tachycardia, increased levophed requirement, lactate 3.9 > 2.6. Slight downtrend in Hgb from 8.4-->7.8, but also in setting of significant fluids. 12/19-12/22: Patient made CMO by family. Patient expired on 12/22/19 in the OR",NA,2,2019-12-16 00:58:00,2019-12-17 09:38:00,6.04,2019-12-16 00:58:00,2019-12-17 09:38:00,17.3,2019-12-17 09:38:00,6,1,1,2019-12-16 05:00:00,1,2019-12-16 05:00:00,2019-12-15 11:23:00,2019-12-16 00:58:00,2019-12-16 08:37:00,2019-12-16 08:37:00,1,1,1,1,1,1,2019-12-22 10:30:00,25.4666666666667,58.1333333333333,33.1166666666667,29.5,29.5,179,179,11.8833333333333,15.3666666666667,48.0333333333333,23.0166666666667,19.4,19.4,168.9,168.9,1.78333333333333,1576483800,2019-12-16 05:00:00,29.5,19.4,8,0
6,"6","2693539",NA,336,1,1,336,2020-01-08 17:44:00,2020-02-07 17:18:00,2020-01-09 08:42:00,2020-01-22 16:56:00,2020-01-08 16:00:00,"61F with hx of AFIB (on rivaroxaban), heart failure, asthma, HTN, presented on 1/8/2020 with worst headache of life, and left sided weakness.  LKW 4pm on 1/8/20. Symptoms started shortly after, was unable to move left side, complained of headache. NIHSS 19 for not following commands, R gaze preference, LHH, left facial weakness, left arm plegia, and minimal L leg movement antigravity to pain, aphasia, dysarthria, and some degree of left side neglect. BP in trauma bay 190s-210s systolic, Glu 118 in the field, 91 in ED. CT Brain showed no bleeds, and R dense MCA. CTA showed R distal ICA occlusion. Not a candidate for tPA due to xarelto use, which per family she was adherent to.  Reviewed imaging with Dr. Nguyen, and taken for thrombectomy. Consent obtained from daughter Kathy Gelin.   Prior to thrombectomy, patient was intubated for airway protection.  Underwent thrombectomy, 7 passes, TICI 2c. Transferred to neuro ICU s/p procedure.  The patient was transferred to neuroICU for further monitoring. MRI showed infarcted territory in R. MCA territory. Neurosurgery was consulted for hemicrani watch. On 1/10 the patient stopped following commands and CTH showed worsening edema and herniation. She was started on Q3H alternating hypertonics with improvement in exam again.   ICU Course   1/12: Increased amlodipine to 10mg and lisinopril to 40mg daily, Temp 100.8-> Pan cultured 1/13 Started on dex 4 q6 no cough leak, 2+ (FEW) STAPHYLOCOCCUS AUREUS started on vancomycin1/14 UA and procal negative, sputum pending. CXR improving, D/C Hypertonics and mannitol with Na goal 145-155, No Cuff leak, keep steroids Ceftriaxone dose increased to 2g along 1/15 UC growing e coli. Sputum with GNR and GPC so will treat for both x 7 days 1/16 extubate today,Precedex restarted in the setting of agitation 1/17 increased WOB, increased secretions, guardianship initiated 1/18 reintubated overnight for copious secretions and frequent suctioning, family is upset 1/19 down on tidal volume, up on FiO2 (60-70%), new pneumonia, LLL infiltrate on chest xray, micro pending, cooling blanket 1/21 multiple episodes of mucus plugging w/ de-sats to 80s on vent, came up w/ aggressive chest PT and suction. Started on Xeralto.  1/22: NCHCT after Xeralto stable.  Episodes of desaturation (PEEP 12, FIO2 80). Vent changed to PC.  Concern for PE, started on Heparin gtt. ABG X2 reveal O2 sat 99.  Weaned FIO2 and PEEP and placed back on AC.  ECHO EF 70-75%, dilated atria, mild TR 1/24 #8 tracheostomy placed at bedside, lots of secretions, FWF decreased for normal Na.  1/25: Pt pulled trach, suction catheter unable to pass.  Scoped and granulomas seen. Pt able to be oxygenated and ventilated. Thoracic consulted for granuloma-> NTD. PEEP decreased 10-> 5. Xeralto restarted.  Emergently went to OR and had #8 Bovana placed.  1/26: No events, weaning from ventilator. 1/28: PSV  Stopped Xeralto for PEG placement  1/31: PEG placed.  Started on Coumadin d/t Xeralto failure.  2/2: 34 beat run of VT, self limited. Cardiology curbside and suggested Metoprolol. 2/3: Warfarin increased. Weaned Clonidine.  Not tolerating PSV. Cardiology consulted for VT: started metoprolol. 2/4: Given the fact she was not tolerating PSV yesterday (she became tachypneic) and she had to be increased from 10/5 to 12/5 a CXR was ordered. CXR was negative. SICU team reevaluated PEG given the patient abdominal pain. No concerns with PEG. Pt will be treated for GERD. 2/5: Decreased Clonidine to 0.1 bid.  Increased lopressor to 75 qid for elevated HR.  Increased Neurontin to 300 tid for pain.  PS 5/5.  Being screened for LTAC.  2/6: Red and induration and complaining of pain at site-> surgery I & D: large amount serosanguinous fluid removed.  PSV 10/5.  RUQ ultrasound-> splenomegaly, numerous gallstones without cholecystitis 2/7: Placed on PSV 10/5.  Induration improved around PEG.  Surgery exchanged Bovana tracheostomy for #8Shiley, bronchoscopy done and no granuloma seen",0,16.7,14.9666666666667,1.73333333333333,2,62,0,1,0,91,6.2,19,0,"Exam prior to intubation  General: distress due to pain, holding head on the right side  Neck: supple  Mental Status: awake, complains of pain, did not follow commands, did not answer questions about age or month. Very dysarthric  Cranial Nerve: PERRL, no BTT on the left, BTT present on right, R gaze preference, dense L lower facial weakness  Motor: left arm plegic to NBP, left leg withdraws minimally antigravity to NBP. Right arm and right leg antigravity spontaneously  Sensory: decreased grimace to pain on the left  Coordination: deferred  Reflexes: L to upgoing, R downgoing  Gait: deferred",14,2020-01-09 07:33:00,15.55,0,"Physical Exam  Intubated, on Fentanyl  Opens eyes to pain briefly  PERRL, R gaze preference  +cough  +corneals  Able to follow commands on R  Shows 2 fingers in RUE  Wiggles toes in RLE  No movement to pain in LUE  TF to pain in LLE",0,NA,1,2020-01-08 17:44:00,4,1,48,1,1,0,0,1,0,NA,NA,"Heart Failure",1,0,0,NA,0,0,0,0,"Hospital Course:   61F with hx of?AFIB (on rivaroxaban), heart failure, asthma, HTN, presented on 1/8/2020 with worst headache of life, and left sided weakness.  ?  LKW 4pm on 1/8/20. Symptoms started shortly after, was unable to move left side, complained of headache. NIHSS 19 for not following commands,?R?gaze preference, LHH, left facial weakness, left arm plegia, and minimal L leg movement antigravity to pain, aphasia,?dysarthria, and some degree of left side neglect. BP in trauma bay 190s-210s systolic, Glu 118 in the field, 91 in ED. CT Brain showed no bleeds, and R dense MCA. CTA showed R distal ICA occlusion. Not a candidate for tPA due to xarelto use, which per family she was adherent to. ?Reviewed imaging with Dr. Nguyen, and taken for thrombectomy. Consent obtained from daughter Kathy?Gelin.   Prior to thrombectomy, patient was intubated for airway protection.  Underwent thrombectomy, 7 passes, TICI 2c.?Transferred to neuro ICU s/p procedure.  ?  The patient was transferred to neuroICU for further monitoring. MRI showed infarcted territory in R. MCA territory. Neurosurgery was consulted for hemicrani watch. On 1/10 the patient stopped following commands and CTH showed worsening edema and herniation. She was started on Q3H alternating hypertonics with improvement in exam again.?",NA,2,2020-01-10 13:37:00,2020-01-10 13:37:00,3.74,2020-01-09 02:59:00,2020-01-09 02:50:00,8.52,2020-01-10 13:37:00,6,1,1,2020-01-10 13:00:00,0,2020-01-10 13:00:00,2020-01-08 17:58:00,2020-01-10 13:37:00,2020-01-10 13:37:00,2020-01-09 02:50:00,1,1,1,1,1,0,NA,45.6166666666667,10.8333333333333,NA,45,45,721.3,NA,1.96666666666667,43.8833333333333,9.1,NA,43.2666666666667,43.2666666666667,719.566666666667,NA,0.233333333333333,1579712160,2020-01-10 13:00:00,45,43.2666666666667,6,1
7,"7","5127606",NA,134,1,1,324,2020-01-18 11:15:00,2020-01-25 21:10:00,2020-01-18 22:16:00,2020-01-23 21:37:00,2020-01-18 08:00:00,"58yo M with a history of CAD presenting with concern for acute stroke. His wife provides collateral. She states that she had seen him well last around 8AM when he was having coffee, up and about the house. She had come back home around 8 or so and had found him on the floor fallen. She was initially concerned he had hurt his back as he has complained of chronic neck pain before, but found that when she spoke to him he was not able to respond to her questions and was not moving his arms properly.   He was brought to Good Samaritan Hospital by EMS where he was found to be without speech as well as with right sided weakness. There was initial concern for STEMI which on review was LVH pattern by their read. A CT/CTA was obtained. TPA was not administered at OSH.  He was transferred to BMC for acute stroke treatment and went directly to IR. In IR he received an aspirin suppository due to concern for high likelihood need of carotid stenting.   His wife and family state that he has a history of CAD for which he has received stenting in the past; he has been supposed to take aspirin daily though she is not sure whether or not he does so on a daily basis. She does not believe he would have taken it today. He used to be on other meds but has not seen a doctor in some time and so has been out of medical care for several years.",0,14.2666666666667,11.0166666666667,3.25,2,58,1,4,0,167,7.7,25,0,"Male in bed, not responding to questions  MSE: Awake, regards examiner with stimulus, appears to prefer left. Some groans with no speech, no command following  CN: L gaze preference without deviation. Inconsistent but apparently diminished BTT on the R on initial assessment, R facial droop.  Motor:  UE-No spont movement on the R, extends to noxious on the R. L with at least some AG not sustained.  LE-No spont movement on the R, min withdraw to noxious, L with some AG to noxious   Sensory: appears to respond to noxious on all 4, L more so than R",18,2020-01-19 06:00:00,22,0,"General: nad  Mental Status: awake, eyes open to voice then spont, following commands, eyes, tongue, raise limbs. No spontaneous speech but will say yes and no.  CN: PEERL 3-->2, no BTT on right,  Motor: LUE/LLE spont and antigravity with no drift. LUE extends, LLE TF  Sensation: grimaces to pinch in all 4 ext  ?  Pulm: ctab  CV: rrr, no m/r/g  Abdomen: soft, nt, nd  ?  Glasgow Coma Scale  Eye Opening: (4) Spontaneous (eyes open, not necessarily aware)  Motor Response: (6) Obeys commands (follows simple commands)  Verbal Response: (4) Confused (converses, but confused, disoriented)  Total GCS Score (3-15): 14",0,NA,1,2020-01-18 11:15:00,5,1,7,0,0,0,0,1,0,NA,NA,"CAD",1,0,1,2020-01-21 18:55:00,1,1,0,0,"58yo M with a history of CAD presenting with concern for acute stroke. ? His wife provides collateral. She states that she had seen him well last around 8AM when he was having coffee, up and about the house. She had come back home around 8 or so and had found him on the floor fallen. She was initially concerned he had hurt his back as he has complained of chronic neck pain before, but found that when she spoke to him he was not able to respond to her questions and was not moving his arms properly.  ? His wife and family state that he has a history of CAD for which he has received stenting in the past; he has been supposed to take aspirin daily though she is not sure whether or not he does so on a daily basis. She does not believe he would have taken it today. He used to be on other meds but has not seen a doctor in some time and so has been out of medical care for several years. ? Patient?was brought to Good Samaritan Hospital by EMS where he was found to be without speech as well as with right sided weakness. There was initial concern for STEMI which on review was LVH pattern by their read. A CT/CTA was obtained, showing tandem L ICA / MCA occlusion.?TPA was not administered at OSH. ? Patient?was transferred to BMC for acute stroke treatment and went directly to IR.?He underwent thrombectomy with TICI 3 reperfusion and carotid stent placement.?In IR he received an aspirin suppository.    58yo M with a history of CAD presenting with concern for acute stroke.  ?  His wife provides collateral. She states that she had seen him well last around 8AM when he was having coffee, up and about the house. She had come back home around 8 or so and had found him on the floor fallen. She was initially concerned he had hurt his back as he has complained of chronic neck pain before, but found that when she spoke to him he was not able to respond to her questions and was not moving his arms properly.   ?  His wife and family state that he has a history of CAD for which he has received stenting in the past; he has been supposed to take aspirin daily though she is not sure whether or not he does so on a daily basis. She does not believe he would have taken it today. He used to be on other meds but has not seen a doctor in some time and so has been out of medical care for several years.  ?  Patient?was brought to Good Samaritan Hospital by EMS where he was found to be without speech as well as with right sided weakness. There was initial concern for STEMI which on review was LVH pattern by their read. A CT/CTA was obtained, showing tandem L ICA / MCA occlusion.?TPA was not administered at OSH.  ?  Patient?was transferred to BMC for acute stroke treatment and went directly to IR.?He underwent thrombectomy with TICI 3 reperfusion and carotid stent placement.?In IR he received an aspirin suppository.  ?  ?  ICU Course:  1/19: repeat head Ct shows IVH bleed in L ventricle, there is some contrast present in parenchyma L frontal/parietal region with increase mass effect?7mm midline shift---> 3% given x1,?1/20: repeat head ct shows stable bleed/ivh, and worsening midline shift. Started?on?Na?23.4% q 6 hrs.??MRI performed, 1/21?Increase WOB/SOB/Tachy->?CXR with edema, ABG, lasix given X 2, placed?on BiPAP but unable to tolerate and?Intubated,?NCHCT showed an increase?in?midline shift,?Mannitol q 6 hrs started,?Mannitol given, osmo gap <6 now,?ECHO: EF 35%, global hypokineses with some regional wall motion variation. ?Negative bubble.  Sputum Cultures: 1+ gram positive cocci in pairs, 1 + rare gram positive bacilli?1/22-?Restarted ASA,?NCHCT 1/21 ->new small infarct in the left superior frontal gyrus. Labetalol 10mg x1 ?and catapril increased to 50mg in the setting of sbp>140 and nicardipine gtt max out,?Demerol given 25mg x1 and buspar started in the setting of shivering desating into high 80s low 90s,?weaned to Pressure support, ABG in 1hr,?NSG d/c'd subdural jp, Started on arctic sun in the setting of febrile?1/23?NCHCT:?Interval progression in hypodensity representing infarct predominately in the left ACA  Territory.1/24: Family meeting, made DNR and then transitioned to CMO after further discussion amongst family members.  Terminally extubated and placed on Morphine infusion.  1/25: Continues on Morphine infusion surrounded by family and deceased at 9:10 pm.",NA,2,2020-01-19 02:26:00,2020-01-19 08:05:00,11.8,2020-01-20 10:35:00,NA,1.78,2020-01-21 21:18:00,2,1,1,2020-01-21 13:45:00,1,2020-01-21 13:45:00,2020-01-18 14:09:00,2020-01-19 02:26:00,2020-01-19 08:05:00,2020-01-21 18:55:00,1,0,1,1,1,1,2020-01-25 21:10:00,18.4333333333333,NA,82.9166666666667,77.75,77.75,181.166666666667,181.166666666667,6.15,15.1833333333333,NA,79.6666666666667,74.5,74.5,177.916666666667,177.916666666667,2.9,1579815420,2020-01-21 13:45:00,77.75,74.5,10,1
