604,"604","5434832","3022195",NA,1,1,NA,2022-11-19 00:48:00,2023-05-16 11:32:00,2022-11-19 02:35:00,2022-11-26 19:31:00,2022-11-18 21:00:00,"HPI: Mary Ozuruoha is a 85 y.o. or 83 yo Igbo speaking female with unclarified PMHX presenting on and seen on 11/19/22 for CODE stroke given Left body weakness.     Patient has a duplicate chart listed with an ultimate birthday and MRN 3022195.  She has an Igbo speaking woman with prior medical history of hypertension hyperlipidemia and atrial fibrillation.  She was most recently in Nigeria and was diagnosed with a stroke causing paralysis to her left side in July.  Prior to the stroke per daughter at bedside for collateral information she was compliant to her apixaban however it is unclear how compliant she is to her medications since then.      Per EMS, patient went to bed at 9 PM and woke up at midnight with symptoms.  She describes the left-sided weakness is new and worse.  While she at baseline is weak on the left side she is able to walk and take care of general state of affairs.  She is conversant at baseline without dysarthria.  The daughter is able to confirm that her voice is atypical.    General Assessment:  Stroke Admission Assessment  Date last known well:: 11/18/22  Time last known well:: 2100  Date of discovery of symptoms:: 11/19/22  Time of discovery of symptoms:: 0000  Was time difference between last known well and ED arrival less than 4.5 hours?: No  Date acute stroke team was called:: 11/19/22  Time acute stroke team was called:: 0037  Date acute stroke team was at bedside:: 11/19/22  Time acute stroke team was at bedside:: 0040  Date of CT Results:: 11/19/22  Time of CT Results:: 0115  Does your patient meet criteria for a dysphagia screen?: Yes        IV TPA  tPA decision date:: 11/19/22  tPA decision time:: 0045  Was IV TPA initiated at this hospital?: No, patient was outside of time window for tPA   ",1,NA,NA,3.8,2,84,0,4,3,112,8.2,15,0,"General:              NAD, lying in bed.         Mental Status:               Alert and Oriented to name, orientation questions impaired by language barrier.  Patient's state her name.  Intact language with no slurring in Igbo however <7 word sentences.  Could not name 'pen' in English   Cranial Nerve:               PERRL, EOMI, Blinks to threat on Right and Left side. Right gaze preference and did not cross midline on VOR initially.               Symmetric facial sensation. Assymetric face at rest with left sided weakness.               Hearing intact. Tongue midline.   Motor:               Flaccid hemiparesis, only withdraws to pain on the left arm and leg.   Sensory:               Withdraws to nox stim bilaterally.   Coordination:               No Ataxia with FNF to right hand, intact to the left hand.",NA,NA,NA,NA,NA,0,NA,0,NA,NA,NA,NA,1,1,0,1,1,0,NA,NA,"HLD",0,0,0,NA,0,0,0,0,"Reason for Inpatient Admission/Chief Complaint: L sided weakness  ˇ  Hospital Course:   Mary Ozuruohaˇis an 85 y.o.ˇor 83 yo Igboˇspeaking femaleˇwith PMHx prior R MCA stroke (in Nigeria, July 2022?), HTN, HLD, and Afib (alternate MRN 3022195)ˇwho initially presented to BMC on 11/19/22ˇas a CODE stroke for left sided weakness in the setting of recently stopping her apixaban when flying from Nigeria to the US. She was found to have a R M1 occlusion thought to be cardioembolic in the setting of atrial fibrillation with apixaban noncompliance. No TPA given since she was out of the window and no MT attempted due to low ASPECTS score.  ˇ  Her hospital course has been prolonged and complicated by respiratory failure and dysphagia now s/p trach + G tube converted to GJ tube (11/29/22), refractory atrial fibrillation with RVR requiring addition of digoxin to her home metoprolol rate control regimen, tachy-brady syndrome with consideration of pacemaker for sustained bradycardia, but patient was not stable for this procedure. She also had multiple aspiration events requiring vent support and treatment of pseudomonas HAP, Klebsiella HAP s/p treatment with ceftriaxone, and ear pain with otoscopic exam showing cerumen impaction managed with carbamide peroxide ear drops. Lastly, she required a second ICU admission due to a cluster of seizures with R arm and leg shaking with EEG correlate, now controlled on Keppra 1250 -> 1000 mg BID.  ˇ  She was transferred back to the ICU on 4/18/22 due to worsening respiratory status, fevers, and hypotension, found to be in septic shock due to polymicrobial bacteremia 2/2 UTI with klebsiella and enteroccocus, treated with cefiderocol narrowed to ceftriaxone as well as ampicillin. Blood cultures were trended until they were clear. ICU course was also complicated by LUE cellulitis s/p 5 days of vancomycin as well as acute on chronic HFpEF exacerbation c/b contraction metabolic alkalosis due to excessive third spacing with chronic hypoalbuminemia that was treated with diamox and lasix for diuresis. She required pressors and mechanical ventilation upon re-admission to ICU, and was eventually weaned off pressors but required mechanical ventilation due to pulmonary edema from volume overload that was eventually weaned off on 5/2/2023. She was discharged in stable condition.   ˇ  Problem Course:  #R MCA stroke (R M1 occlusion)  On presentation on 11/19/22, patient went to bed at 9 PM and woke up at midnight with left sided weakness that was new and worse despite her prior R MCA stroke. This occurred in the setting of stopping her home apixaban. No TPA given out of window and no MT attempted given low ASPECTS score. MRI/MRA on 11/23/22 showed edema and midline shift. She required intubation due to poor mental status in the ICU, and due to failed SBT, required eventual trach. She also had persistent dysphagia due to her large stroke, and required G tube that was eventually converted to a GJ tube. She was initially placed on a heparin gtt and restarted on her home apixaban 5 mg BID (increased from 2.5 mg BID given increased weight >60 kg now). Etiology of stroke presumed cardioembolic due to missed AC with atrial fibrillation. TTE showed LVEF >80% and no PFO. ILR not placed given known atrial fibrillation on anticoagulation. For risk factor mangaement, patient was continued on her home BP regimen and atorvastatin for goal LDL <70.  ˇ  #Seizures  Initial event on 3/1/23. Semiology of R leg --> arm shaking, head turn to right and left gaze deviation. S/p Keppra 3.5 g load and started on 1 g BID. Transferred to the ICU, where a similar event was captured on EEG on 3/2/23 with note of left 2 hz spikes, likely representing a focal seizure arising form a deep focus. No clear provoking infection and repeat MRI without apparent left sided focus (known R MCA stroke would not be causing this semiology), however on our review there does appear to be potential hippocampal sclerosis/temporal atrophy.   - Keppra was started and gradually increased to 1250 mg -> 1000 mg BID and there were no further events.  ˇ  #Afib with RVR  #Tachybrady syndrome  Increasing periods of Afib with RVR so cardiology was consulted and digoxin was started. She also had ongoing issues concerning for tachy-brady syndrome, with heart rates at minimum of high 30s, and at other times afib with RVR up to 170s. Cardiology did not feel that digoxin would worsen the bradycardia, and frequent adjustments / holdings were made for metoprolol. Cardiology suggested possibility of pacemaker should sustained bradycardia continue to be a problem, but patient was generally not sufficiently stable for such a procedure. Eventually, patient had stable rate/rhythm control on digoxin 0.125 mg daily and metoprolol 25 mg Q6H.  ˇ  #Acute on chronic HFpEF  Volume overloaded. BNP 768 (4/23) -> 603 (4/27). CXR with worsening bilateral pulmonary edema and pleural effusions, intervally improved on 4/29 but still volume up on beside POCUS. S/pˇmultiple doses of diamox and lasix with albumin given 4/28-4/30 with no significant change on CXR/inability to wean vent. Net negative 1L.ˇ73 kg from 69 kg.ˇEDW around 66.5 kg (?) on 4/19/23. Home GDMT includes lisinopril 40, amlodipine 10, ˇMetop 25 q6h, and chlorthalidone 25. Lisinopril, amlodipine, and chlorthalidone have been held due to low blood pressure.   ˇ  #Secretions  - she received Botox injections into the parotid glands 12/8/22 & 4/14/23   - Some improvement with scopolamine patch.   ˇ  #Chronic dysphagia  #Nutrition   Due to tube feed intolerance, she was switched to a higher-density formula and lower goal rate with improvement. After failing multiple speech evaluations, she had a G tube placed that was eventually converted to a G-J tube on 1/31, exchanged/upsized on 2/24 given prior J tube clogged multiple times) clogged again 3/13 and exchanged on 3/16 by IR. GJ tube balloon was found to be ruptured on 5/8, requiring tube replacement again on 5/9.   -J port of GJ tube clogged again on 5/14 and was resolved with pancreatic enzymes.   - Free water flushes for Jport were added and fiber packets were stopped.   - Pt should receive medications via G port   - Pt should received tube feeds via J port.   ˇ  #HTN  For most of her hospitalization patient was normotensive. She is discharged on amlodipine 10mg alone due to adequate BP control on this regimen.   ˇ  #Pain/discomfort (R hip, L shoulder)  - Tylenol 650 mg Q4H PRN  -ˇOxycodone 2.5 mg Q8H PRN  - Lidocaine patch   - Baclofen 5 mg TID  ˇ  Resolved-  ˇ  #Acute on chronic hypoxic respiratory failure s/p trach  #Pseudomonas HAPˇ  Secondary to multiple aspirations, s/p Tracheostomy after unsuccessful extubation trial. Treated for pseudomonas HAP.   ˇ  #Klebsiella and enterococcus bacteremia   S/p cefedericol transitioned to CTX 2 g per ID and ampicillin. CTAP, abdominal US negative. LUE doppler 4/25 with superficial L vein thrombosis. BCx x2 trended q48h until clear. UTI positive for above, likely source.   ˇ  #LUE cellulitis  S/p vancomycin 4/25-4/28, improved on exam 4/27. LUE kept elevated.     #R ear pain  Over the last 3 months, chronically stable, reported by daughter on 3/14. Otoscopy with external ear canal pain and cerumen impaction. No erythema of tympanic membrane. Started carbamide peroxide otic drops BID 3/17 with improvement. ENT consulted and mechanically disimpacted cerumen at bedside with symptomatic improvement.   ˇ  #Microcytic anemia  Hgb 6.8 -> 6.4. Likely due to chronic illness. Fe studies with low iron and normal ferritin- started on ferrous sulfate PO supplementation on 4/29. Transfused PRN for goal Hgb >7.",NA,2,NA,NA,0,2022-11-19 01:02:00,NA,2.98,2022-11-23 01:19:00,3,1,0,2022-11-19 15:00:00,0,NA,2022-11-19 01:02:00,NA,NA,NA,0,0,0,0,0,0,NA,NA,NA,NA,18,NA,4286.53333333333,NA,4.03333333333333,NA,NA,NA,14.2,NA,4282.73333333333,NA,0.233333333333333,1669491060,2022-11-19 15:00:00,18,14.2,9,0
605,"605","5366358",NA,NA,1,1,NA,2022-11-20 00:06:00,2022-12-21 18:45:00,2022-11-20 02:02:00,2022-12-03 16:39:00,2022-11-19 19:30:00,"64M PMH HTN, DM, recent event of monocular vision loss (July 2022), OSA who was in normal state of health until approximately 7:30pm on 11/19/22 when he experienced sudden onset left arm and leg weakness. He was brought to Good Samaritan Medical Center and had an NIHSS of 4 (LUE drift 2, LLE drift 2). NCHCT without intracranial hemorrhage and good ASPECTS score. CTA with R inferior M2 branch stenosis vs focal occlusion, with distal reconstitution within the M2 itself. SBPs initially in 190s at Good Sam. He received tPA at 9:48pm and was transferred to BMC for further evaluation and monitoring in the Neuro ICU.     Upon arrival here, vitals: T 97.4, BP 192/116, HR 79, RR 24, O2 sat % on room air later requiring NRB for desat to low 80s. NIHSS 11 (questions 1, commands 2, left visual field cut 2, L NLF flattening 1, LUE 2, sensory 1, dysarthria 1, extinction 1). CTA repeated at BMC; no intracranial hemorrhage; presence of R M2 critical stenosis as opposed to occlusion given good immediate distal reconstitution. tPA was given at outside hospital. Mechanical thrombectomy not pursued given likely critical stenosis over occlusion, and loss of grey-white matter differentiation seen posteriorly.     Initial vitals: T 97.4, HR 79, RR 24, BP 192/116, O2 sat 97% on NRB  Labs: WBC 11, Hgb 17.8, others pending  Imaging: done at OSH showing R inferior branch M2 critical stenosis; repeat CTA done here shows the same    Stroke Admission Assessment  Date last known well:: 11/19/22  Time last known well:: 1930  Date of discovery of symptoms:: 11/19/22  Time of discovery of symptoms:: 1930  Was time difference between last known well and ED arrival less than 4.5 hours?: Yes  Date acute stroke team was called:: 11/20/22  Time acute stroke team was called:: 0003  Date acute stroke team was at bedside:: 11/20/22  Time acute stroke team was at bedside:: 0003  Date of CT Results:: 11/20/22  Time of CT Results:: 0032  Does your patient meet criteria for a dysphagia screen?: Yes",1,6.53333333333333,1.93333333333333,4.6,2,64,1,4,1,404,11,11,0,"Mental Status: Awake, oriented to own age; does not answer month question and does not follow commands of closing eyes or making a fist. Agitated and regularly moves left arm and left leg in space. Does not follow commands consistently. Speech with mild dysarthria. Unable to count people on the left side of the room. When asked who his left hand belongs to, he answers 'nurse'  Cranial Nerves: Pupils equal and reactive, no blink to threat on left bilaterally, right gaze preference and eyes cross midline bilaterally, slight left nasolabial fold flattening  Motor: LUE drifts to bed; RUE and BLE antigravity without drift. Normal tone. No atrophy. No tremors  Sensation: Does not withdraw LLE to noxious stimuli. Extinction to left with double simultaneous sensory stimuli in arms  Cerebellum: No dysmetria on FNF although difficult for him to follow along with left arm",NA,NA,NA,NA,NA,1,2022-11-19 19:40:00,0,NA,NA,1,14,0,1,1,0,0,0,NA,NA,NA,1,0,1,2022-11-21 12:51:00,0,0,0,0,"64M PMH HTN, DM, recent event of monocular vision loss (July 2022), OSAˇwho was in normal state of health until approximately 7:30pm on 11/19/22ˇwhen he experienced sudden onsetˇleft arm and leg weakness. He was brought to Good Samaritan Medical Center and had an NIHSS of 4 (LUE drift 2, LLE drift 2). NCHCT without intracranial hemorrhage and good ASPECTS score. CTA with R inferior M2 branch stenosis vs focal occlusion, with distal reconstitution within the M2 itself. SBPs initially in 190s at Good Sam. He received tPA at 9:48pm and was transferred to BMC for further evaluation and monitoring in the Neuro ICU.  ˇ  Upon arrival here, vitals: Tˇ97.4, BPˇ192/116, HRˇ79, RRˇ24, O2 sat % on room airˇlater requiring NRB for desat to low 80s. NIHSSˇ11ˇ(questions 1, commands 2, left visual field cut 2, L NLF flattening 1, LUE 2, sensory 1, dysarthria 1, extinction 1).ˇCTA repeated at BMC; no intracranial hemorrhage; presence of R M2 critical stenosis as opposed to occlusion given good immediate distal reconstitution. tPA was given at outside hospital. Mechanical thrombectomy not pursued given likely critical stenosis over occlusion, and loss of grey-white matter differentiation seen posteriorly.  Imaging:ˇdone at OSH showingˇR inferior branch M2ˇcriticalˇstenosis; repeat CTA done hereˇshows the same.  ˇ   In the ICU, patient intubated due to lethargy and hypoxia with CT demonstrating malignant edema for which decompressive hemicraniectomy was performed with improvement in mental status. ICU course complicated by HAP, treated w/ ertapenam, PE requiring thrombectomy and heparin gtt, and pseudo-obstruction which resolved with increased bowel regimen. Patient extubated to high flow nasal cannula and was stable for transfer to stroke service.  ˇ  On the floors, patient passed for a puree diet, oxygen level weaned from high flow nasal cannula to 2-3L nasal cannula, then able to maintain 90-91% minimum on RA, higher when awake. Heparin gtt transitioned to apixaban. Patient continued to fail voiding trials requiring him to be discharged with foley catheter with plan for OP urology follow up. Due to patient leaning on side of hemicraniectomy, developed small area of blood at the edge of the hemicraniectomy site, which was stable. Throughout hospital course, patient's exam improved, with him now able to move L arm and L leg antigravity.",NA,2,2022-11-21 00:56:00,2022-11-21 00:56:00,9.79,2022-11-21 00:56:00,NA,3.43,2022-11-21 22:27:00,9,1,1,2022-11-21 08:00:00,0,2022-11-21 08:00:00,2022-11-21 00:56:00,2022-11-21 00:56:00,2022-11-21 00:56:00,2022-11-21 12:51:00,1,0,1,1,1,1,NA,29.4333333333333,NA,41.35,36.5,36.5,767.25,NA,29.4333333333333,24.8333333333333,NA,36.75,31.9,31.9,762.65,NA,24.8333333333333,1670085540,2022-11-21 08:00:00,36.5,31.9,7,1
608,"608","5439631",NA,NA,1,0,NA,2022-12-13 03:43:00,2023-01-21 15:44:00,2022-12-13 11:54:00,2022-12-20 19:54:00,2022-12-12 18:00:00,"59M PMH small cell lung cancer s/p chemotherapy, HTN, CAD, spinal stenosis, anxiety who presents as a transfer from Catholic Medical Center for mechanical thrombectomy.     Last known well 12/12/22 at 6pm. He told his wife he felt unwell and subsequently became expressively aphasic with right-sided weakness and left gaze deviation. He was taken to OSH >6 hours after last known well, out of the tPA window, and was found to have L ICA and M1 tandum occlusion. NCHCT with ASPECT 6. He was transferred to BMC for thrombectomy.     Upon arrival at BMC, NIHSS 24 mostly for L MCA syndrome.",1,NA,NA,9.71666666666667,2,59,1,4,0,121,10.6,24,NA,"Mental Status: Eyes open at baseline, nonverbal, follows command of opening/closing eyes.   Cranial Nerves: Pupils equal, left gaze preference, right homonymous hemianopsia, no facial asymmetry without activation  Motor: RUE and RLE without movement. LUE and LLE drift down to bed. No atrophy. No tremors  Sensation: Grimaces to noxious stimuli  Cerebellum: Deferred     PULM : On NC, Coarse BS. Decreased at Left base.   CVS : S1/ S2, RRR  ABD : Soft",NA,NA,NA,NA,NA,0,NA,1,2022-12-13 07:53:00,2,NA,8,0,1,0,0,1,0,0,NA,"small cell lung cancer s/p chemotherapy, HTN, CAD, spinal stenosis, anxiety",1,NA,0,NA,0,0,0,0,"59 yo M hx small cell lung ca s/p chemo, CAD, HTN, spinal stenosis, anxiety who presented w/ R-sided weakness. NIHSS 24 for L MCA syndrome (no movement on R, mute). CT w/ L ICA / M1 tandem occlusion: transferred for MT (TICI 2A w/ balloon angioplasty). Complicated by hemorrhagic conversion and cerebral edema: did not receive hemicraniectomy. LDL 85, A1C 5.3%: stated on atorvastatin. For HTN, he was restared on dose-reduced home losartan. His course was complicated by R femoral DVT (provoked) requiring apixaban (will need 3-month course). He has passed SLP for texture-modified diet. He is alert with dense global aphasia, right hemianopsia, and right-sided weakness (plegia of the arm, relative weakness of the leg).","ivy 1.29.24: Global Cerebral Atrophy Score",0,2022-12-13 23:19:00,2022-12-15 05:24:00,13.9,2022-12-16 04:05:00,2022-12-16 18:42:00,4.2,2022-12-16 18:42:00,6,0,0,NA,0,NA,2022-12-13 15:22:00,2022-12-13 23:19:00,2022-12-15 05:24:00,2022-12-16 18:42:00,1,1,1,1,1,0,NA,29.3166666666667,96.7,NA,NA,NA,957.733333333333,NA,21.3666666666667,19.6,86.9833333333333,NA,NA,NA,948.016666666667,NA,11.65,1671566040,2022-12-20 19:55:00,193.916666666667,184.2,6,1
610,"610","5336759",NA,NA,1,1,NA,2023-01-03 14:45:00,2023-02-24 15:14:00,2023-01-03 17:50:00,2023-01-10 20:51:00,2023-01-03 11:26:00,"75yo Albanian speaking male with PMH of HTN, CAD, Hx of gastric CA, and HLD presents as transfer from Good Samaritan hospital for mechanical thrombectomy.   Per report patient was last seen normal at 1126 when he was playing piano with his grandson, his son then head a fall from the other room and found his father not speaking or moving his right side. Taken to Good Sam and was found to have a L ICA/MCA tandem occlusion. He was given tpa at Good Sam, per report it was started at 1359. Patient was accepted for transfer directly to IR for angiogram.      Medication List per Care everywhere (12/2022)  Pantoprazole 40mg daily  Aspirin 81mg daily  Irbesartan 1500mg nightly  Rosuvastatin 20mg daily  Tenoretic 100-25mg 1/2 tab BID",1,6.4,3.08333333333333,3.31666666666667,2,75,1,4,3,130,12.2,25,0,"General: s/p MT, on no sedation, awake, nonverbal, albanian speaking, in cervical collar  Mental Status: Eyes open spontaneously, left gaze preference  CN - Eyes midline, conjugate, PERRL 2mm bilaterally, BTT, corneals to lash bilaterally Motor: LUE antigravity, localizing, RUE hypertonic, fingers contracted, no purposeful mvmt, LLE purposeful movement in bed, antigravity, RLE withdrawing to painful stimulus  Sensation: deferred  Cerebellum: deferred  Gait: deferred  Pulmonary: LS CTA bilaterally, satting well on RA, no abnormal resp pattern  Cardio: RRR, S1S2, QTC & PR intervals WNL, no ischemic changes noted on admission 12 lead  Abdomen: Abd SNT, BS present, strict NPO while flat",NA,NA,NA,NA,"General: acutely ill male lying supine in bed in c-collar  Mental Status: Eyes open to voice, left gaze preference  CN - Eyes midline, conjugate,able to cross midline   R npi 4.7 size 3.22 L npi 4.9 size 2.37, BTT bilat, corneals to lash bilaterally, mild right nasolabial fold flattening    Motor: LUE antigravity, localizing, RUE with flexion to pain, LLE purposeful movement in bed (crossing leg over right leg),  RLE triple flexes to pain   Sensation: questionable sensation in LLE (no grimace to pain, no elevated heart rate)   Cerebellum: deferred  Gait: deferred  Pulmonary: LS CTA bilaterally, satting well on RA, no abnormal resp pattern  Cardio: RRR, S1S2, QTC & PR intervals WNL,trending Q4H HST  Abdomen: Abd SNT, BS present, strict NPO pending SLP eval",1,2023-01-03 13:59:00,1,2023-01-03 17:23:00,5,NA,8,0,1,0,0,1,0,0,NA,"CAD (3 coronary stents placed in Albania 20 years ago) hx of hiatal hernia, and HLD",1,1,0,NA,0,0,0,0,"Reason for Inpatient Admission/Chief Complaint:   Mr. Beltoja 75 y/o Albanian M with HTN, CAD (3 coronary stents placed in Albania 20 years ago) hx of hiatal hernia, and HLD, presented to Good Samaritan hospital on 1/3 with aphasia and right-sided hemiplegia, last known well on 12/3 at 11:26 when he was playing piano with his grandson, his son then head a fall from the other room and found his father not speaking or moving his right side. Taken to Good Sam and was found to have a L ICA/MCA tandem occlusion. He was given tpa at Good Sam, per report it was started at 1359. Patient was accepted for transfer directly to IR for angiogram.  ˇ  Hospital Course:   CT/CTA showed tandem ICA/MCA occlusion, patient received and completed tPA at OSH and was subsequently transferred to BMC for mechanical thrombectomy. Patient underwent 5 passes with TICI 3 reperfusion and was transferred to NCC for monitoring. Repeat imaging on 1/4 demonstrated MCA/PCA infarction. He did not get an MRI due to unable to confirm information about patient's stents. While in the neuro ICU, patient converted from NSR to afib with RVR, likely the etiology of the stroke (cardioembolic), and was started on metoprolol for rate control. Anticoagulation for atrial fibrillation was restarted on 1/17/23 after holding for 2 weeks.   ˇ  Hospital course has been complicated by dysphagia. He initially had a NGT  placed by ENT. Patient has had multiple failed swallow studies and has thus remained NPO with crushed meds. A gastrostomy tube was placed on 1/24/23. There were no complications and patient has been tolerating tube feeds. He also had multiple infections including an H. Flu pneumonia and completed a 5 day course of antibiotics. Patient developed a UTI with urine and blood cultures positive for Pseudomonas and was treated with cefepime. Patient also had agitation which improved with scheduled Depakote.   ˇ  Labs were last checked on 2/24. Of note, he had a leukocytosis of 23.4. He was afebrile with stable vitals. There were no localizing signs or symptoms of infection. A CXR was clear without any opacification. A UA was performed with 3+ leukocyte exterase, 1+ blood, >100 WBC, and negative bacteria. This UA was consistent with multiple prior UAs performed and patient has been treated for UTI twice this admission. Will not treat this time.   ˇ",NA,2,2023-01-07 16:28:00,NA,6.7,2023-01-07 16:28:00,2023-01-07 16:28:00,4.17,2023-01-07 16:28:00,10,0,0,NA,0,NA,2023-01-03 23:55:00,2023-01-07 16:28:00,NA,2023-01-07 16:28:00,0,1,1,0,1,0,NA,101.033333333333,101.033333333333,NA,NA,NA,1251.8,NA,12.4833333333333,97.7166666666667,97.7166666666667,NA,NA,NA,1248.48333333333,NA,9.16666666666667,1673383860,2023-01-10 20:52:00,177.433333333333,174.116666666667,7,0
